Year,Title,PDF Link,Authors,Download Time,Annotation
2020,Fast and Flexible Temporal Point Processes with Triangular Maps,https://papers.nips.cc/paper_files/paper/2020/file/00ac8ed3b4327bdd4ebbebcb2ba10a00-Paper.pdf,"Shchur, Oleksandr, Gao, Nicholas, Biloš, Marin, Günnemann, Stephan",2025-02-15 10:03:10,Deep Learning
2020,Backpropagating Linearly Improves Transferability of Adversarial Examples,https://papers.nips.cc/paper_files/paper/2020/file/00e26af6ac3b1c1c49d7c3d79c60d000-Paper.pdf,"Guo, Yiwen, Li, Qizhang, Chen, Hao",2025-02-15 10:03:13,Computer Vision
2020,PyGlove: Symbolic Programming for Automated Machine Learning,https://papers.nips.cc/paper_files/paper/2020/file/012a91467f210472fab4e11359bbfef6-Paper.pdf,"Peng, Daiyi, Dong, Xuanyi, Real, Esteban, Tan, Mingxing, Lu, Yifeng, Bender, Gabriel, Liu, Hanxiao, Kraft, Adam, Liang, Chen, Le, Quoc",2025-02-15 10:03:27,Optimization
2020,Fourier Sparse Leverage Scores and Approximate Kernel Learning,https://papers.nips.cc/paper_files/paper/2020/file/012d9fe15b2493f21902cd55603382ec-Paper.pdf,"Erdelyi, Tamas, Musco, Cameron, Musco, Christopher",2025-02-15 10:03:34,Optimization
2020,Improved Algorithms for Online Submodular Maximization via First-order Regret Bounds,https://papers.nips.cc/paper_files/paper/2020/file/0163cceb20f5ca7b313419c068abd9dc-Paper.pdf,"Harvey, Nicholas, Liaw, Christopher, Soma, Tasuku",2025-02-15 10:03:36,Optimization
2020,Synbols: Probing Learning Algorithms with Synthetic Datasets,https://papers.nips.cc/paper_files/paper/2020/file/0169cf885f882efd795951253db5cdfb-Paper.pdf,"Lacoste, Alexandre, Rodríguez López, Pau, Branchaud-Charron, Frederic, Atighehchian, Parmida, Caccia, Massimo, Laradji, Issam Hadj, Drouin, Alexandre, Craddock, Matthew, Charlin, Laurent, Vázquez, David",2025-02-15 10:03:40,Computer Vision
2020,Adversarially Robust Streaming Algorithms via Differential Privacy,https://papers.nips.cc/paper_files/paper/2020/file/0172d289da48c48de8c5ebf3de9f7ee1-Paper.pdf,"Hasidim, Avinatan, Kaplan, Haim, Mansour, Yishay, Matias, Yossi, Stemmer, Uri",2025-02-15 10:03:44,Optimization
2020,Trading Personalization for Accuracy: Data Debugging in Collaborative Filtering,https://papers.nips.cc/paper_files/paper/2020/file/019fa4fdf1c04cf73ba25aa2223769cd-Paper.pdf,"Chen, Long, Yao, Yuan, Xu, Feng, Xu, Miao, Tong, Hanghang",2025-02-15 10:03:48,NLP
2020,Cascaded Text Generation with Markov Transformers,https://papers.nips.cc/paper_files/paper/2020/file/01a0683665f38d8e5e567b3b15ca98bf-Paper.pdf,"Deng, Yuntian, Rush, Alexander",2025-02-15 10:03:51,NLP
2020,Improving Local Identifiability in Probabilistic Box Embeddings,https://papers.nips.cc/paper_files/paper/2020/file/01c9d2c5b3ff5cbba349ec39a570b5e3-Paper.pdf,"Dasgupta, Shib, Boratko, Michael, Zhang, Dongxu, Vilnis, Luke, Li, Xiang, McCallum, Andrew",2025-02-15 10:03:53,Deep Learning
2020,Permute-and-Flip: A new mechanism for differentially private selection,https://papers.nips.cc/paper_files/paper/2020/file/01e00f2f4bfcbb7505cb641066f2859b-Paper.pdf,"McKenna, Ryan, Sheldon, Daniel R.",2025-02-15 10:03:55,Optimization
2020,Reciprocal Adversarial Learning via Characteristic Functions,https://papers.nips.cc/paper_files/paper/2020/file/021f6dd88a11ca489936ae770e4634ad-Paper.pdf,"Li, Shengxi, Yu, Zeyang, Xiang, Min, Mandic, Danilo",2025-02-15 10:04:04,Computer Vision
2020,Statistical Guarantees of Distributed Nearest Neighbor Classification,https://papers.nips.cc/paper_files/paper/2020/file/022e0ee5162c13d9a7bb3bd00fb032ce-Paper.pdf,"Duan, Jiexin, Qiao, Xingye, Cheng, Guang",2025-02-15 10:04:08,Optimization
2020,Stein Self-Repulsive Dynamics: Benefits From Past Samples,https://papers.nips.cc/paper_files/paper/2020/file/023d0a5671efd29e80b4deef8262e297-Paper.pdf,"Ye, Mao, Ren, Tongzheng, Liu, Qiang",2025-02-15 10:04:16,'Optimization'
2020,The Statistical Complexity of Early-Stopped Mirror Descent,https://papers.nips.cc/paper_files/paper/2020/file/024d2d699e6c1a82c9ba986386f4d824-Paper.pdf,"Vaskevicius, Tomas, Kanade, Varun, Rebeschini, Patrick",2025-02-15 10:04:23,Optimization
2020,Deep reconstruction of strange attractors from time series,https://papers.nips.cc/paper_files/paper/2020/file/021bbc7ee20b71134d53e20206bd6feb-Paper.pdf,"Gilpin, William",2025-02-15 10:04:26,Deep Learning
2020,Algorithmic recourse under imperfect causal knowledge: a probabilistic approach,https://papers.nips.cc/paper_files/paper/2020/file/02a3c7fb3f489288ae6942498498db20-Paper.pdf,"Karimi, Amir-Hossein, von Kügelgen, Julius, Schölkopf, Bernhard, Valera, Isabel",2025-02-15 10:04:30,Causal Reasoning
2020,A Causal View on Robustness  of Neural Networks,https://papers.nips.cc/paper_files/paper/2020/file/02ed812220b0705fabb868ddbf17ea20-Paper.pdf,"Zhang, Cheng, Zhang, Kun, Li, Yingzhen",2025-02-15 10:04:35,Computer Vision
2020,Minimax Classification with 0-1 Loss and Performance Guarantees,https://papers.nips.cc/paper_files/paper/2020/file/02f657d55eaf1c4840ce8d66fcdaf90c-Paper.pdf,"Mazuelas, Santiago, Zanoni, Andrea, Pérez, Aritz",2025-02-15 10:04:40,Optimization
2020,Quantitative Propagation of Chaos for SGD in Wide Neural Networks,https://papers.nips.cc/paper_files/paper/2020/file/02e74f10e0327ad868d138f2b4fdd6f0-Paper.pdf,"De Bortoli, Valentin, Durmus, Alain, Fontaine, Xavier, Simsekli, Umut",2025-02-15 10:04:43,Optimization
2020,How to Learn a Useful Critic? Model-based Action-Gradient-Estimator Policy Optimization,https://papers.nips.cc/paper_files/paper/2020/file/03255088ed63354a54e0e5ed957e9008-Paper.pdf,"D'Oro, Pierluca,  Jaśkowski, Wojciech",2025-02-15 10:04:47,Reinforcement Learning
2020,Coresets for Regressions with Panel Data,https://papers.nips.cc/paper_files/paper/2020/file/03287fcce194dbd958c2ec5b33705912-Paper.pdf,"Huang, Lingxiao, Sudhir, K, Vishnoi, Nisheeth",2025-02-15 10:04:50,Optimization
2020,Learning Composable Energy Surrogates for PDE Order Reduction,https://papers.nips.cc/paper_files/paper/2020/file/0332d694daab22e0e0eaf7a5e88433f9-Paper.pdf,"Beatson, Alex, Ash, Jordan, Roeder, Geoffrey, Xue, Tianju, Adams, Ryan P.",2025-02-15 10:04:54,Optimization
2020,Efficient Contextual Bandits with Continuous Actions,https://papers.nips.cc/paper_files/paper/2020/file/033cc385728c51d97360020ed57776f0-Paper.pdf,"Majzoubi, Maryam, Zhang, Chicheng, Chari, Rajan, Krishnamurthy, Akshay, Langford, John, Slivkins, Aleksandrs",2025-02-15 10:04:57,Reinforcement Learning
2020,Achieving Equalized Odds by Resampling Sensitive Attributes,https://papers.nips.cc/paper_files/paper/2020/file/03593ce517feac573fdaafa6dcedef61-Paper.pdf,"Romano, Yaniv, Bates, Stephen, Candes, Emmanuel",2025-02-15 10:05:00,Optimization
2020,Hard Shape-Constrained Kernel Machines,https://papers.nips.cc/paper_files/paper/2020/file/03fa2f7502f5f6b9169e67d17cbf51bb-Paper.pdf,"Aubin-Frankowski, Pierre-Cyril, Szabo, Zoltan",2025-02-15 10:05:10,Optimization
2020,Multi-Robot Collision Avoidance under Uncertainty with Probabilistic Safety Barrier Certificates,https://papers.nips.cc/paper_files/paper/2020/file/03793ef7d06ffd63d34ade9d091f1ced-Paper.pdf,"Luo, Wenhao, Sun, Wen, Kapoor, Ashish",2025-02-15 10:05:12,Optimization
2020,A Closer Look at the Training Strategy for Modern Meta-Learning,https://papers.nips.cc/paper_files/paper/2020/file/0415740eaa4d9decbc8da001d3fd805f-Paper.pdf,"CHEN, JIAXIN, Wu, Xiao-Ming, Li, Yanke, LI, Qimai, Zhan, Li-Ming, Chung, Fu-lai",2025-02-15 10:05:17,Meta-Learning
2020,On the Value of Out-of-Distribution Testing: An Example of Goodhart's Law,https://papers.nips.cc/paper_files/paper/2020/file/045117b0e0a11a242b9765e79cbf113f-Paper.pdf,"Teney, Damien, Abbasnejad, Ehsan, Kafle, Kushal, Shrestha, Robik, Kanan, Christopher, van den Hengel, Anton",2025-02-15 10:05:20,NLP
2020,Generalised Bayesian Filtering via Sequential Monte Carlo,https://papers.nips.cc/paper_files/paper/2020/file/04ecb1fa28506ccb6f72b12c0245ddbc-Paper.pdf,"Boustati, Ayman, Akyildiz, Omer Deniz, Damoulas, Theodoros, Johansen, Adam",2025-02-15 10:05:25,Bayesian Filtering
2020,Deterministic Approximation for Submodular Maximization over a Matroid in Nearly Linear Time,https://papers.nips.cc/paper_files/paper/2020/file/05128e44e27c36bdba71221bfccf735d-Paper.pdf,"Han, Kai, Cao, zongmai, Cui, Shuang, Wu, Benwei",2025-02-15 10:05:27,Optimization
2020,Flows for simultaneous manifold learning and density estimation,https://papers.nips.cc/paper_files/paper/2020/file/051928341be67dcba03f0e04104d9047-Paper.pdf,"Brehmer, Johann, Cranmer, Kyle",2025-02-15 10:05:37,Optimization
2020,Simultaneous Preference and Metric Learning from Paired Comparisons,https://papers.nips.cc/paper_files/paper/2020/file/0561bc7ecba98e39ca7994f93311ba23-Paper.pdf,"Xu, Austin, Davenport, Mark",2025-02-15 10:06:00,'Optimization'
2020,Efficient Variational Inference for Sparse Deep Learning with Theoretical Guarantee,https://papers.nips.cc/paper_files/paper/2020/file/05a624166c8eb8273b8464e8d9cb5bd9-Paper.pdf,Unknown,2025-02-15 10:06:05,Deep Learning
2020,Sample Efficient Reinforcement Learning via Low-Rank Matrix Estimation,https://papers.nips.cc/paper_files/paper/2020/file/8d2355364e9a2ba1f82f975414937b43-Paper.pdf,Unknown,2025-02-15 10:06:12,Reinforcement Learning
2020,MetaPoison: Practical General-purpose Clean-label Data Poisoning,https://papers.nips.cc/paper_files/paper/2020/file/8ce6fc704072e351679ac97d4a985574-Paper.pdf,Unknown,2025-02-15 10:06:21,Deep Learning
2020,Hold me tight! Influence of discriminative features on deep network boundaries,https://papers.nips.cc/paper_files/paper/2020/file/1ea97de85eb634d580161c603422437f-Paper.pdf,Unknown,2025-02-15 10:06:55,Computer Vision
2020,A Bandit Learning Algorithm and Applications to Auction Design,https://papers.nips.cc/paper_files/paper/2020/file/8ccf1fb8b09a8212bafea305cf5d5e9f-Paper.pdf,Unknown,2025-02-15 10:07:01,Optimization
2020,Neural Architecture Generator Optimization,https://papers.nips.cc/paper_files/paper/2020/file/8c53d30ad023ce50140181f713059ddf-Paper.pdf,Unknown,2025-02-15 10:07:07,Optimization
2020,Model Agnostic Multilevel Explanations,https://papers.nips.cc/paper_files/paper/2020/file/426f990b332ef8193a61cc90516c1245-Paper.pdf,Unknown,2025-02-15 10:07:10,NLP
2020,NeuMiss networks: differentiable programming for supervised learning with missing values.,https://papers.nips.cc/paper_files/paper/2020/file/42ae1544956fbe6e09242e6cd752444c-Paper.pdf,Unknown,2025-02-15 10:07:18,Deep Learning
2020,Neural Topographic Factor Analysis for fMRI Data,https://papers.nips.cc/paper_files/paper/2020/file/8c3c27ac7d298331a1bdfd0a5e8703d3-Paper.pdf,Unknown,2025-02-15 10:07:22,NLP
2020,Continuous Submodular Maximization: Beyond DR-Submodularity,https://papers.nips.cc/paper_files/paper/2020/file/0f34132b15dd02f282a11ea1e322a96d-Paper.pdf,Unknown,2025-02-15 10:07:25,Optimization
2020,Logarithmic Pruning is All You Need,https://papers.nips.cc/paper_files/paper/2020/file/1e9491470749d5b0e361ce4f0b24d037-Paper.pdf,Unknown,2025-02-15 10:07:28,Deep Learning
2020,Random Reshuffling is Not Always Better,https://papers.nips.cc/paper_files/paper/2020/file/42299f06ee419aa5d9d07798b56779e2-Paper.pdf,Unknown,2025-02-15 10:07:32,Optimization
2020,Temporal Spike Sequence Learning via Backpropagation for Deep Spiking Neural Networks,https://papers.nips.cc/paper_files/paper/2020/file/8bdb5058376143fa358981954e7626b8-Paper.pdf,Unknown,2025-02-15 10:07:34,'Deep Learning'
2020,Guiding Deep Molecular Optimization with Genetic Exploration,https://papers.nips.cc/paper_files/paper/2020/file/8ba6c657b03fc7c8dd4dff8e45defcd2-Paper.pdf,Unknown,2025-02-15 10:07:37,Deep Learning
2020,TSPNet: Hierarchical Feature Learning via Temporal Semantic Pyramid for Sign Language Translation,https://papers.nips.cc/paper_files/paper/2020/file/8c00dee24c9878fea090ed070b44f1ab-Paper.pdf,Unknown,2025-02-15 10:07:40,NLP
2020,GPU-Accelerated Primal Learning for Extremely Fast Large-Scale Classification,https://papers.nips.cc/paper_files/paper/2020/file/41e7637e7b6a9f27a98b84d3a185c7c0-Paper.pdf,Unknown,2025-02-15 10:07:42,Optimization
2020,Implicit Graph Neural Networks,https://papers.nips.cc/paper_files/paper/2020/file/8b5c8441a8ff8e151b191c53c1842a38-Paper.pdf,Unknown,2025-02-15 10:07:47,Deep Learning
2020,Toward the Fundamental Limits of Imitation Learning,https://papers.nips.cc/paper_files/paper/2020/file/1e7875cf32d306989d80c14308f3a099-Paper.pdf,Unknown,2025-02-15 10:07:51,Reinforcement Learning
2020,Stochastic Normalizing Flows,https://papers.nips.cc/paper_files/paper/2020/file/41d80bfc327ef980528426fc810a6d7a-Paper.pdf,Unknown,2025-02-15 10:07:57,'Deep Learning'
2020,On the Trade-off between Adversarial and Backdoor Robustness,https://papers.nips.cc/paper_files/paper/2020/file/8b4066554730ddfaa0266346bdc1b202-Paper.pdf,Unknown,2025-02-15 10:08:13,'Deep Learning'
2020,Global Convergence of Deep Networks with One Wide Layer Followed by Pyramidal Topology,https://papers.nips.cc/paper_files/paper/2020/file/8abfe8ac9ec214d68541fcb888c0b4c3-Paper.pdf,Unknown,2025-02-15 10:08:16,Deep Learning
2020,Neuron Shapley: Discovering the Responsible Neurons,https://papers.nips.cc/paper_files/paper/2020/file/41c542dfe6e4fc3deb251d64cf6ed2e4-Paper.pdf,Unknown,2025-02-15 10:08:27,Deep Learning
2020,Rethinking Importance Weighting for Deep Learning under Distribution Shift,https://papers.nips.cc/paper_files/paper/2020/file/8b9e7ab295e87570551db122a04c6f7c-Paper.pdf,Unknown,2025-02-15 10:08:39,'Deep Learning'
2020,A graph similarity for deep learning,https://papers.nips.cc/paper_files/paper/2020/file/0004d0b59e19461ff126e3a08a814c33-Paper.pdf,,2025-02-15 10:14:18,Deep Learning
2020,Self-Supervised MultiModal Versatile Networks,https://papers.nips.cc/paper_files/paper/2020/file/0060ef47b12160b9198302ebdb144dcf-Paper.pdf,,2025-02-15 10:14:22,'Computer Vision'
2020,"Benchmarking Deep Inverse Models over time, and the Neural-Adjoint method",https://papers.nips.cc/paper_files/paper/2020/file/007ff380ee5ac49ffc34442f5c2a2b86-Paper.pdf,,2025-02-15 10:14:26,Deep Learning
2020,An Unsupervised Information-Theoretic Perceptual Quality Metric,https://papers.nips.cc/paper_files/paper/2020/file/00482b9bed15a272730fcb590ffebddd-Paper.pdf,,2025-02-15 10:14:29,Computer Vision
2020,Off-Policy Evaluation and Learning for External Validity under a Covariate Shift,https://papers.nips.cc/paper_files/paper/2020/file/0084ae4bc24c0795d1e6a4f58444d39b-Paper.pdf,,2025-02-15 10:14:32,Reinforcement Learning
2020,Fast and Flexible Temporal Point Processes with Triangular Maps,https://papers.nips.cc/paper_files/paper/2020/file/00ac8ed3b4327bdd4ebbebcb2ba10a00-Paper.pdf,,2025-02-15 10:14:37,Optimization
2020,Neural Methods for Point-wise Dependency Estimation,https://papers.nips.cc/paper_files/paper/2020/file/00a03ec6533ca7f5c644d198d815329c-Paper.pdf,,2025-02-15 10:14:40,'Deep Learning'
2020,Backpropagating Linearly Improves Transferability of Adversarial Examples,https://papers.nips.cc/paper_files/paper/2020/file/00e26af6ac3b1c1c49d7c3d79c60d000-Paper.pdf,,2025-02-15 10:14:43,Computer Vision
2020,Fourier Sparse Leverage Scores and Approximate Kernel Learning,https://papers.nips.cc/paper_files/paper/2020/file/012d9fe15b2493f21902cd55603382ec-Paper.pdf,,2025-02-15 10:14:49,Optimization
2020,Improved Algorithms for Online Submodular Maximization via First-order Regret Bounds,https://papers.nips.cc/paper_files/paper/2020/file/0163cceb20f5ca7b313419c068abd9dc-Paper.pdf,,2025-02-15 10:14:52,Optimization
2020,Synbols: Probing Learning Algorithms with Synthetic Datasets,https://papers.nips.cc/paper_files/paper/2020/file/0169cf885f882efd795951253db5cdfb-Paper.pdf,,2025-02-15 10:14:56,Computer Vision
2020,Adversarially Robust Streaming Algorithms via Differential Privacy,https://papers.nips.cc/paper_files/paper/2020/file/0172d289da48c48de8c5ebf3de9f7ee1-Paper.pdf,,2025-02-15 10:15:01,Privacy
2020,Trading Personalization for Accuracy: Data Debugging in Collaborative Filtering,https://papers.nips.cc/paper_files/paper/2020/file/019fa4fdf1c04cf73ba25aa2223769cd-Paper.pdf,,2025-02-15 10:15:05,NLP
2020,Cascaded Text Generation with Markov Transformers,https://papers.nips.cc/paper_files/paper/2020/file/01a0683665f38d8e5e567b3b15ca98bf-Paper.pdf,,2025-02-15 10:15:10,NLP
2020,Improving Local Identifiability in Probabilistic Box Embeddings,https://papers.nips.cc/paper_files/paper/2020/file/01c9d2c5b3ff5cbba349ec39a570b5e3-Paper.pdf,,2025-02-15 10:15:14,Deep Learning
2020,Permute-and-Flip: A new mechanism for differentially private selection,https://papers.nips.cc/paper_files/paper/2020/file/01e00f2f4bfcbb7505cb641066f2859b-Paper.pdf,,2025-02-15 10:15:17,Optimization
2020,PyGlove: Symbolic Programming for Automated Machine Learning,https://papers.nips.cc/paper_files/paper/2020/file/012a91467f210472fab4e11359bbfef6-Paper.pdf,,2025-02-15 10:15:29,Optimization
2020,Deep reconstruction of strange attractors from time series,https://papers.nips.cc/paper_files/paper/2020/file/021bbc7ee20b71134d53e20206bd6feb-Paper.pdf,,2025-02-15 10:15:47,Deep Learning
2020,Reciprocal Adversarial Learning via Characteristic Functions,https://papers.nips.cc/paper_files/paper/2020/file/021f6dd88a11ca489936ae770e4634ad-Paper.pdf,,2025-02-15 10:15:54,'Deep Learning'
2020,Statistical Guarantees of Distributed Nearest Neighbor Classification,https://papers.nips.cc/paper_files/paper/2020/file/022e0ee5162c13d9a7bb3bd00fb032ce-Paper.pdf,,2025-02-15 10:16:05,Optimization
2020,Stein Self-Repulsive Dynamics: Benefits From Past Samples,https://papers.nips.cc/paper_files/paper/2020/file/023d0a5671efd29e80b4deef8262e297-Paper.pdf,,2025-02-15 10:16:11,Optimization
2020,The Statistical Complexity of Early-Stopped Mirror Descent,https://papers.nips.cc/paper_files/paper/2020/file/024d2d699e6c1a82c9ba986386f4d824-Paper.pdf,,2025-02-15 10:16:19,Optimization
2020,Algorithmic recourse under imperfect causal knowledge: a probabilistic approach,https://papers.nips.cc/paper_files/paper/2020/file/02a3c7fb3f489288ae6942498498db20-Paper.pdf,,2025-02-15 10:16:23,Causal Inference
2020,Quantitative Propagation of Chaos for SGD in Wide Neural Networks,https://papers.nips.cc/paper_files/paper/2020/file/02e74f10e0327ad868d138f2b4fdd6f0-Paper.pdf,,2025-02-15 10:16:47,Optimization
2020,Minimax Classification with 0-1 Loss and Performance Guarantees,https://papers.nips.cc/paper_files/paper/2020/file/02f657d55eaf1c4840ce8d66fcdaf90c-Paper.pdf,,2025-02-15 10:17:04,Optimization
2020,A Causal View on Robustness  of Neural Networks,https://papers.nips.cc/paper_files/paper/2020/file/02ed812220b0705fabb868ddbf17ea20-Paper.pdf,,2025-02-15 10:17:36,Deep Learning
2020,How to Learn a Useful Critic? Model-based Action-Gradient-Estimator Policy Optimization,https://papers.nips.cc/paper_files/paper/2020/file/03255088ed63354a54e0e5ed957e9008-Paper.pdf,Unknown,2025-02-15 10:17:51,Reinforcement Learning
2020,Hold me tight! Influence of discriminative features on deep network boundaries,https://papers.nips.cc/paper_files/paper/2020/file/1ea97de85eb634d580161c603422437f-Paper.pdf,Unknown,2025-02-15 10:18:26,Computer Vision
2020,A Bandit Learning Algorithm and Applications to Auction Design,https://papers.nips.cc/paper_files/paper/2020/file/8ccf1fb8b09a8212bafea305cf5d5e9f-Paper.pdf,Unknown,2025-02-15 10:18:31,Optimization
2020,Neural Architecture Generator Optimization,https://papers.nips.cc/paper_files/paper/2020/file/8c53d30ad023ce50140181f713059ddf-Paper.pdf,Unknown,2025-02-15 10:18:36,Optimization
2020,Model Agnostic Multilevel Explanations,https://papers.nips.cc/paper_files/paper/2020/file/426f990b332ef8193a61cc90516c1245-Paper.pdf,Unknown,2025-02-15 10:18:40,NLP
2020,Neural Topographic Factor Analysis for fMRI Data,https://papers.nips.cc/paper_files/paper/2020/file/8c3c27ac7d298331a1bdfd0a5e8703d3-Paper.pdf,Unknown,2025-02-15 10:18:46,NLP
2020,TSPNet: Hierarchical Feature Learning via Temporal Semantic Pyramid for Sign Language Translation,https://papers.nips.cc/paper_files/paper/2020/file/8c00dee24c9878fea090ed070b44f1ab-Paper.pdf,Unknown,2025-02-15 10:18:51,Computer Vision
2020,NeuMiss networks: differentiable programming for supervised learning with missing values.,https://papers.nips.cc/paper_files/paper/2020/file/42ae1544956fbe6e09242e6cd752444c-Paper.pdf,Unknown,2025-02-15 10:18:57,'Deep Learning'
2020,Continuous Submodular Maximization: Beyond DR-Submodularity,https://papers.nips.cc/paper_files/paper/2020/file/0f34132b15dd02f282a11ea1e322a96d-Paper.pdf,Unknown,2025-02-15 10:18:59,Optimization
2020,Random Reshuffling is Not Always Better,https://papers.nips.cc/paper_files/paper/2020/file/42299f06ee419aa5d9d07798b56779e2-Paper.pdf,Unknown,2025-02-15 10:19:02,Optimization
2020,Logarithmic Pruning is All You Need,https://papers.nips.cc/paper_files/paper/2020/file/1e9491470749d5b0e361ce4f0b24d037-Paper.pdf,Unknown,2025-02-15 10:19:08,Deep Learning
2020,Temporal Spike Sequence Learning via Backpropagation for Deep Spiking Neural Networks,https://papers.nips.cc/paper_files/paper/2020/file/8bdb5058376143fa358981954e7626b8-Paper.pdf,Unknown,2025-02-15 10:19:10,Deep Learning
2020,Guiding Deep Molecular Optimization with Genetic Exploration,https://papers.nips.cc/paper_files/paper/2020/file/8ba6c657b03fc7c8dd4dff8e45defcd2-Paper.pdf,Unknown,2025-02-15 10:19:13,Deep Learning
2020,GPU-Accelerated Primal Learning for Extremely Fast Large-Scale Classification,https://papers.nips.cc/paper_files/paper/2020/file/41e7637e7b6a9f27a98b84d3a185c7c0-Paper.pdf,Unknown,2025-02-15 10:19:18,Optimization
2020,Implicit Graph Neural Networks,https://papers.nips.cc/paper_files/paper/2020/file/8b5c8441a8ff8e151b191c53c1842a38-Paper.pdf,Unknown,2025-02-15 10:19:21,'Deep Learning'
2020,Toward the Fundamental Limits of Imitation Learning,https://papers.nips.cc/paper_files/paper/2020/file/1e7875cf32d306989d80c14308f3a099-Paper.pdf,Unknown,2025-02-15 10:19:23,Reinforcement Learning
2020,Rethinking Importance Weighting for Deep Learning under Distribution Shift,https://papers.nips.cc/paper_files/paper/2020/file/8b9e7ab295e87570551db122a04c6f7c-Paper.pdf,Unknown,2025-02-15 10:19:34,Deep Learning
2020,On the Trade-off between Adversarial and Backdoor Robustness,https://papers.nips.cc/paper_files/paper/2020/file/8b4066554730ddfaa0266346bdc1b202-Paper.pdf,Unknown,2025-02-15 10:19:48,Deep Learning
2020,Stochastic Normalizing Flows,https://papers.nips.cc/paper_files/paper/2020/file/41d80bfc327ef980528426fc810a6d7a-Paper.pdf,Unknown,2025-02-15 10:19:53,Optimization
2020,Global Convergence of Deep Networks with One Wide Layer Followed by Pyramidal Topology,https://papers.nips.cc/paper_files/paper/2020/file/8abfe8ac9ec214d68541fcb888c0b4c3-Paper.pdf,Unknown,2025-02-15 10:19:56,Deep Learning
2020,A Novel Approach for Constrained Optimization in Graphical Models,https://papers.nips.cc/paper_files/paper/2020/file/8ab9bb97ce35080338be74dc6375e0ed-Paper.pdf,Unknown,2025-02-15 10:19:59,Optimization
2020,Neuron Shapley: Discovering the Responsible Neurons,https://papers.nips.cc/paper_files/paper/2020/file/41c542dfe6e4fc3deb251d64cf6ed2e4-Paper.pdf,Unknown,2025-02-15 10:20:01,Deep Learning
2020,Counterexample-Guided Learning of Monotonic Neural Networks,https://papers.nips.cc/paper_files/paper/2020/file/8ab70731b1553f17c11a3bbc87e0b605-Paper.pdf,Unknown,2025-02-15 10:20:03,Deep Learning
2020,A Unifying View of Optimism in Episodic Reinforcement Learning,https://papers.nips.cc/paper_files/paper/2020/file/0f0e13216262f4a201bec128044dd30f-Paper.pdf,Unknown,2025-02-15 10:20:05,Reinforcement Learning
2020,A graph similarity for deep learning,https://papers.nips.cc/paper_files/paper/2020/file/0004d0b59e19461ff126e3a08a814c33-Paper.pdf,Unknown Authors,2025-02-15 10:23:53,Graph Similarity for Deep Learning
2020,An Unsupervised Information-Theoretic Perceptual Quality Metric,https://papers.nips.cc/paper_files/paper/2020/file/00482b9bed15a272730fcb590ffebddd-Paper.pdf,Unknown Authors,2025-02-15 10:24:00,Computer Vision
2020,Self-Supervised MultiModal Versatile Networks,https://papers.nips.cc/paper_files/paper/2020/file/0060ef47b12160b9198302ebdb144dcf-Paper.pdf,Unknown Authors,2025-02-15 10:24:05,'Deep Learning'
2020,"Benchmarking Deep Inverse Models over time, and the Neural-Adjoint method",https://papers.nips.cc/paper_files/paper/2020/file/007ff380ee5ac49ffc34442f5c2a2b86-Paper.pdf,Unknown Authors,2025-02-15 10:24:09,Deep Learning
2020,Neural Methods for Point-wise Dependency Estimation,https://papers.nips.cc/paper_files/paper/2020/file/00a03ec6533ca7f5c644d198d815329c-Paper.pdf,Unknown Authors,2025-02-15 10:24:11,'Deep Learning'
2020,Off-Policy Evaluation and Learning for External Validity under a Covariate Shift,https://papers.nips.cc/paper_files/paper/2020/file/0084ae4bc24c0795d1e6a4f58444d39b-Paper.pdf,Unknown Authors,2025-02-15 10:24:14,Reinforcement Learning
2020,Fast and Flexible Temporal Point Processes with Triangular Maps,https://papers.nips.cc/paper_files/paper/2020/file/00ac8ed3b4327bdd4ebbebcb2ba10a00-Paper.pdf,Unknown Authors,2025-02-15 10:24:18,Deep Learning
2020,Backpropagating Linearly Improves Transferability of Adversarial Examples,https://papers.nips.cc/paper_files/paper/2020/file/00e26af6ac3b1c1c49d7c3d79c60d000-Paper.pdf,Unknown Authors,2025-02-15 10:24:20,Computer Vision
2020,PyGlove: Symbolic Programming for Automated Machine Learning,https://papers.nips.cc/paper_files/paper/2020/file/012a91467f210472fab4e11359bbfef6-Paper.pdf,Unknown Authors,2025-02-15 10:24:30,Optimization
2020,Improved Algorithms for Online Submodular Maximization via First-order Regret Bounds,https://papers.nips.cc/paper_files/paper/2020/file/0163cceb20f5ca7b313419c068abd9dc-Paper.pdf,Unknown Authors,2025-02-15 10:24:34,Optimization
2020,Synbols: Probing Learning Algorithms with Synthetic Datasets,https://papers.nips.cc/paper_files/paper/2020/file/0169cf885f882efd795951253db5cdfb-Paper.pdf,Unknown Authors,2025-02-15 10:24:39,'Computer Vision'
